{
  "$schema": "../../schema/traca.geometry.schema.v0.2.json",
  "meta": {
    "format": "TRACA_geometria_derivada",
    "version": "0.2.1",
    "exercise_id": "TR-UVOF-015",
    "status": "derived_from_ready_contract",
    "source_spatial_ref": "exercises/TR-UVOF-015/spatial-relations.json",
    "source_spatial_digest": "sha256:9717a4dc2b1c532f4b74aca97d0ca15aefcbbd21daa1df4a6caf22f6ca4e717d",
    "court_profile_ref": "config/handball-court.ihf-2025.json",
    "court_profile_digest": "86a26b089ec1a92080ae93b855dce519eb6f7900bc371c8e2e348c3a8ac4a35a"
  },
  "court": {
    "width_m": 20.0,
    "half_length_m": 20.0,
    "goal": {
      "width_m": 3.0,
      "height_m": 2.0,
      "post_width_m": 0.08
    },
    "markings": {
      "goal_area_radius_m": 6.0,
      "goal_area_straight_m": 3.0,
      "free_throw_distance_m": 9.0,
      "free_throw_segment_m": 0.15,
      "free_throw_gap_m": 0.15,
      "penalty_line_distance_m": 7.0,
      "penalty_line_length_m": 1.0,
      "goalkeeper_line_distance_m": 4.0,
      "goalkeeper_line_length_m": 0.15,
      "throw_off_diameter_m": 4.0
    },
    "view_box": [
      -0.8,
      -1.0,
      21.6,
      21.8
    ]
  },
  "layout_policy": {
    "id": "uvof015_three_zones_v0.2.1",
    "status": "provisional_render_policy",
    "coordinate_system": "metres_origin_goal_line_left",
    "attack_direction": "negative_y",
    "notes": [
      "Les amplades de les tres zones són una política visual simètrica, no coneixement tàctic.",
      "Cap alternativa decisional se selecciona al JSON; la interfície només en previsualitza una per duel.",
      "Les posicions es deriven després d'un preflight ready i no modifiquen la font espacial.",
      "Els espais tàctics són relacions internes ocultes; només els límits físics poden aparèixer en control.",
      "Les corbes i els canvis de direcció provenen de segments funcionals resolts, no del renderer."
    ]
  },
  "zones": [
    {
      "id": "Z_ESQ",
      "kind": "physical_task_boundary",
      "source_ref": "exercises/TR-UVOF-015/spatial-relations.json#/espais/0",
      "polygon": [
        [
          1.25,
          5.15
        ],
        [
          7.1,
          5.15
        ],
        [
          7.1,
          15.25
        ],
        [
          1.25,
          15.25
        ]
      ],
      "limit_refs": [
        "LIM_0",
        "LIM_1"
      ],
      "defender_ref": "D_ESQ",
      "defensive_line": [
        [
          1.6,
          7.6
        ],
        [
          6.75,
          7.6
        ]
      ],
      "render_policy": "control_only"
    },
    {
      "id": "Z_CE",
      "kind": "physical_task_boundary",
      "source_ref": "exercises/TR-UVOF-015/spatial-relations.json#/espais/1",
      "polygon": [
        [
          7.1,
          5.15
        ],
        [
          12.9,
          5.15
        ],
        [
          12.9,
          15.25
        ],
        [
          7.1,
          15.25
        ]
      ],
      "limit_refs": [
        "LIM_1",
        "LIM_2"
      ],
      "defender_ref": "D_CE",
      "defensive_line": [
        [
          7.45,
          7.6
        ],
        [
          12.55,
          7.6
        ]
      ],
      "render_policy": "control_only"
    },
    {
      "id": "Z_DRE",
      "kind": "physical_task_boundary",
      "source_ref": "exercises/TR-UVOF-015/spatial-relations.json#/espais/2",
      "polygon": [
        [
          12.9,
          5.15
        ],
        [
          18.75,
          5.15
        ],
        [
          18.75,
          15.25
        ],
        [
          12.9,
          15.25
        ]
      ],
      "limit_refs": [
        "LIM_2",
        "LIM_3"
      ],
      "defender_ref": "D_DRE",
      "defensive_line": [
        [
          13.25,
          7.6
        ],
        [
          18.4,
          7.6
        ]
      ],
      "render_policy": "control_only"
    }
  ],
  "spaces": [
    {
      "id": "E_ESQ_A",
      "kind": "relational_tactical_space",
      "source_ref": "exercises/TR-UVOF-015/spatial-relations.json#/espais/3",
      "zone_ref": "Z_ESQ",
      "defender_ref": "D_ESQ",
      "relation": {
        "type": "between",
        "delimiter_refs": [
          "LIM_0",
          "D_ESQ"
        ]
      },
      "anchor": [
        2.712,
        8.25
      ],
      "calculation_region": [
        [
          1.33,
          5.45
        ],
        [
          4.095,
          5.45
        ],
        [
          4.095,
          11.05
        ],
        [
          1.33,
          11.05
        ]
      ],
      "render_policy": "hidden"
    },
    {
      "id": "E_ESQ_B",
      "kind": "relational_tactical_space",
      "source_ref": "exercises/TR-UVOF-015/spatial-relations.json#/espais/4",
      "zone_ref": "Z_ESQ",
      "defender_ref": "D_ESQ",
      "relation": {
        "type": "between",
        "delimiter_refs": [
          "D_ESQ",
          "LIM_1"
        ]
      },
      "anchor": [
        5.637,
        8.25
      ],
      "calculation_region": [
        [
          4.255,
          5.45
        ],
        [
          7.02,
          5.45
        ],
        [
          7.02,
          11.05
        ],
        [
          4.255,
          11.05
        ]
      ],
      "render_policy": "hidden"
    },
    {
      "id": "E_CE_A",
      "kind": "relational_tactical_space",
      "source_ref": "exercises/TR-UVOF-015/spatial-relations.json#/espais/5",
      "zone_ref": "Z_CE",
      "defender_ref": "D_CE",
      "relation": {
        "type": "between",
        "delimiter_refs": [
          "LIM_1",
          "D_CE"
        ]
      },
      "anchor": [
        8.55,
        8.25
      ],
      "calculation_region": [
        [
          7.18,
          5.45
        ],
        [
          9.92,
          5.45
        ],
        [
          9.92,
          11.05
        ],
        [
          7.18,
          11.05
        ]
      ],
      "render_policy": "hidden"
    },
    {
      "id": "E_CE_B",
      "kind": "relational_tactical_space",
      "source_ref": "exercises/TR-UVOF-015/spatial-relations.json#/espais/6",
      "zone_ref": "Z_CE",
      "defender_ref": "D_CE",
      "relation": {
        "type": "between",
        "delimiter_refs": [
          "D_CE",
          "LIM_2"
        ]
      },
      "anchor": [
        11.45,
        8.25
      ],
      "calculation_region": [
        [
          10.08,
          5.45
        ],
        [
          12.82,
          5.45
        ],
        [
          12.82,
          11.05
        ],
        [
          10.08,
          11.05
        ]
      ],
      "render_policy": "hidden"
    },
    {
      "id": "E_DRE_A",
      "kind": "relational_tactical_space",
      "source_ref": "exercises/TR-UVOF-015/spatial-relations.json#/espais/7",
      "zone_ref": "Z_DRE",
      "defender_ref": "D_DRE",
      "relation": {
        "type": "between",
        "delimiter_refs": [
          "LIM_2",
          "D_DRE"
        ]
      },
      "anchor": [
        14.363,
        8.25
      ],
      "calculation_region": [
        [
          12.98,
          5.45
        ],
        [
          15.745,
          5.45
        ],
        [
          15.745,
          11.05
        ],
        [
          12.98,
          11.05
        ]
      ],
      "render_policy": "hidden"
    },
    {
      "id": "E_DRE_B",
      "kind": "relational_tactical_space",
      "source_ref": "exercises/TR-UVOF-015/spatial-relations.json#/espais/8",
      "zone_ref": "Z_DRE",
      "defender_ref": "D_DRE",
      "relation": {
        "type": "between",
        "delimiter_refs": [
          "D_DRE",
          "LIM_3"
        ]
      },
      "anchor": [
        17.288,
        8.25
      ],
      "calculation_region": [
        [
          15.905,
          5.45
        ],
        [
          18.67,
          5.45
        ],
        [
          18.67,
          11.05
        ],
        [
          15.905,
          11.05
        ]
      ],
      "render_policy": "hidden"
    }
  ],
  "entities": [
    {
      "id": "LIM_0",
      "kind": "cone",
      "label": "",
      "position": [
        1.25,
        10.15
      ],
      "source_ref": "exercises/TR-UVOF-015/spatial-relations.json#/nodes/9",
      "status": "derived"
    },
    {
      "id": "LIM_1",
      "kind": "cone",
      "label": "",
      "position": [
        7.1,
        10.15
      ],
      "source_ref": "exercises/TR-UVOF-015/spatial-relations.json#/nodes/10",
      "status": "derived"
    },
    {
      "id": "LIM_2",
      "kind": "cone",
      "label": "",
      "position": [
        12.9,
        10.15
      ],
      "source_ref": "exercises/TR-UVOF-015/spatial-relations.json#/nodes/11",
      "status": "derived"
    },
    {
      "id": "LIM_3",
      "kind": "cone",
      "label": "",
      "position": [
        18.75,
        10.15
      ],
      "source_ref": "exercises/TR-UVOF-015/spatial-relations.json#/nodes/12",
      "status": "derived"
    },
    {
      "id": "A_ESQ",
      "kind": "attacker",
      "label": "A",
      "position": [
        4.175,
        14.1
      ],
      "source_ref": "exercises/TR-UVOF-015/spatial-relations.json#/nodes/0",
      "status": "derived",
      "state_ref": "STATE_ESQ_A_CURRENT"
    },
    {
      "id": "P_ESQ",
      "kind": "passer",
      "label": "P",
      "position": [
        4.175,
        17.1
      ],
      "source_ref": "exercises/TR-UVOF-015/spatial-relations.json#/nodes/6",
      "status": "derived",
      "state_ref": "STATE_ESQ_P_CURRENT"
    },
    {
      "id": "D_ESQ",
      "kind": "defender",
      "label": "D",
      "position": [
        4.175,
        7.6
      ],
      "source_ref": "exercises/TR-UVOF-015/spatial-relations.json#/nodes/3",
      "status": "derived",
      "state_ref": "STATE_ESQ_D_CURRENT"
    },
    {
      "id": "B_ESQ",
      "kind": "ball",
      "label": "",
      "position": [
        4.515,
        13.98
      ],